[
  {
    "adres_type": "zamieszkania",
    "adres_kod_pocztowy": "00-111",
    "adres_wojewodztwo_kod": "kod",
    "adres_powiat_kod": "kod",
    "adres_gmina_kod": "kod",
    "adres_miejscowosc_kod": "kod"
  },
  {
    "adres_type": "pobytu",
    "adres_kod_pocztowy": "21-134",
    "adres_wojewodztwo_nazwa": "inny",
    "adres_powiat_nazwa": "nazwa",
    "adres_gmina_nazwa": "nazwa",
    "adres_miejscowosc_nazwa": "nazwa"
  }
]
